{
  "$schema": "https://json-schema.org/draft/2020-12/schema",
  "$id": "https://folio.local/schemas/types/quadrant.schema.json",
  "title": "Folio Quadrant Authoring Input",
  "type": "object",
  "additionalProperties": false,
  "required": ["schema_version", "kind", "title", "axes", "items"],
  "allOf": [{"if":{"properties":{"canvas":{"const":"poster"}},"required":["canvas"]},"else":{"properties":{"height":{"maximum":800}}}}],
  "properties": {
    "schema_version": {"const": "3.0"}, "kind": {"const": "quadrant"},
    "title": {"$ref": "#/$defs/non-empty-string"},
    "axes": {
      "type": "object", "additionalProperties": false, "required": ["x", "y"],
      "properties": {"x": {"$ref": "#/$defs/axis"}, "y": {"$ref": "#/$defs/axis"}}
    },
    "items": {"type": "array", "minItems": 4, "maxItems": 12, "items": {"$ref": "#/$defs/item"}},
    "preferred_region": {"enum": ["top-left", "top-right", "bottom-left", "bottom-right", null]},
    "canvas": {"enum": ["figure", "poster"]},
    "width": {"const": 960}, "height": {"type": "integer", "minimum": 500, "maximum": 4000, "multipleOf": 4},
    "language": {"$ref": "#/$defs/nullable-string"}
  },
  "$defs": {
    "nullable-string": {"oneOf": [{"type": "null"}, {"$ref": "#/$defs/non-empty-string"}]},
    "non-empty-string": {"type": "string", "pattern": ".*\\S.*"},
    "axis": {
      "type": "object", "additionalProperties": false, "required": ["label", "low", "high"],
      "properties": {
        "label": {"$ref": "#/$defs/non-empty-string"}, "low": {"$ref": "#/$defs/non-empty-string"},
        "high": {"$ref": "#/$defs/non-empty-string"}
      }
    },
    "item": {
      "type": "object", "additionalProperties": false, "required": ["id", "label", "x", "y"],
      "properties": {
        "id": {"$ref": "#/$defs/non-empty-string"}, "label": {"$ref": "#/$defs/non-empty-string"},
        "x": {"type": "number", "minimum": 0, "maximum": 1},
        "y": {"type": "number", "minimum": 0, "maximum": 1},
        "emphasis": {"enum": ["focal", "normal"]}
      }
    }
  }
}
